imdb_title_id,title,original_title,year,date_published,genre,duration,country,language,director,writer,production_company,actors,description,avg_vote,votes,budget,usa_gross_income,worlwide_gross_income,metascore,reviews_from_users,reviews_from_critics
tt0060196,"Il buono, il brutto, il cattivo","Il buono, il brutto, il cattivo",1966,12/23/1966,Western,161,"Italy, Spain, West Germany",Italian,Sergio Leone,"Luciano Vincenzoni, Sergio Leone",Produzioni Europee Associate (PEA),"Eli Wallach, Clint Eastwood, Lee Van Cleef, Aldo Giuffrรจ, Luigi Pistilli, Rada Rassimov, Enzo Petito, Claudio Scarchilli, John Bartha, Livio Lorenzon, Antonio Casale, Sandro Scarchilli, Benito Stefanelli, Angelo Novi, Antonio Casas",A bounty hunting scam joins two men in an uneasy alliance against a third in a race to find a fortune in gold buried in a remote cemetery.,8.8,672499,"$1,200,000 ","$25,100,000 ",25252481.00,90,1117,211
tt0250310,Corky Romano - Agente di seconda mano,Corky Romano,2001,5/31/2002,"Comedy, Crime",86,USA,"English, Vietnamese, Spanish, Thai",Rob Pritts,"David Garrett, Jason Ward",Touchstone Pictures,"Chris Kattan, Vinessa Shaw, Peter Falk, Peter Berg, Chris Penn, Fred Ward, Richard Roundtree, Matthew Glave, Roger Fan, Dave Sheridan, Michael Massee, Vincent Pastore, Fiona Hale, Kip King, Al Eben",The loser son of a Mafia honcho must go undercover for the FBI.,4.7,12398,"$11,000,000 ","$23,980,304 ",25272752.00,20,108,61
tt2390361,Non dico altro,Enough Said,2013,5/15/2014,"Comedy, Drama, Romance",93,USA,English,Nicole Holofcener,Nicole Holofcener,Fox Searchlight Pictures,"Julia Louis-Dreyfus, Lennie Loftin, Jessica St. Clair, Christopher Nicholas Smith, Tracey Fairaway, Toni Collette, Ben Falcone, Michaela Watkins, Catherine Keener, Phillip Brock, James Gandolfini, Tavi Gevinson, Nick L. Williams, Ivy Strohmaier, Natasha Sky Lipson",A divorced woman who decides to pursue the man she's interested in learns he's her new friend's ex-husband.,7,58016,"$8,000,000 ","$17,550,872 ",25288872.00,78,164,242
tt0462396,L'ultima legione,The Last Legion,2007,9/14/2007,"Action, Adventure, War",101,"UK, France, Slovakia, Tunisia, Italy, Bulgaria",English,Doug Lefler,"Jez Butterworth, Tom Butterworth",Dino De Laurentiis Company,"Colin Firth, Ben Kingsley, Aishwarya Rai Bachchan, Peter Mullan, Kevin McKidd, John Hannah, Iain Glen, Thomas Brodie-Sangster, Rupert Friend, Nonso Anozie, Owen Teale, Alexander Siddig, Robert Pugh, James Cosmo, Harry Van Gorkum","As the Roman empire crumbles, young Romulus Augustus flees the city and embarks on a perilous voyage to Britain to track down a legion of supporters.",5.4,33810,"$35,000,000 ","$5,933,494 ",25303038.00,37,180,92
tt0091188,Heartburn - Affari di cuore,Heartburn,1986,10/3/1986,"Comedy, Drama",108,USA,English,Mike Nichols,"Nora Ephron, Nora Ephron",Paramount Pictures,"Meryl Streep, Jack Nicholson, Jeff Daniels, Maureen Stapleton, Stockard Channing, Richard Masur, Catherine O'Hara, Steven Hill, Milos Forman, Mamie Gummer, Karen Akers, Aida Linares, Anna Maria Horsford, Ron McLarty, Kenneth Welsh","She's a magazine writer who gives up her career for love and family. He's a playboy newspaper columnist who can't quite give up his old tricks. And if that combination doesn't give a relationship Heartburn, nothing will.",6.1,9261,"$20,000,000 ","$25,314,189 ",25314189.00,49,54,18
tt2828996,Ghost Movie 2 - Questa volta รจ guerra,A Haunted House 2,2014,5/15/2014,"Comedy, Fantasy",86,USA,English,Michael Tiddes,"Marlon Wayans, Rick Alvarez",Baby Way Productions,"Marlon Wayans, Jaime Pressly, Essence Atkins, Gabriel Iglesias, Missi Pyle, Ashley Rickards, Affion Crockett, Steele Stebbins, Rick Overton, Hayes MacArthur, Dave Sheridan, Cedric the Entertainer, Kurt Carley, Tom Virtue, Kym Whitley","Having exorcised the demons of his ex, Malcolm is starting fresh with his new girlfriend and her two children. After moving into their dream home, however, Malcolm is once again plagued by bizarre paranormal events.",4.7,19363,"$4,000,000 ","$17,329,486 ",25358716.00,17,55,70
tt0455960,The Hitcher,The Hitcher,2007,5/30/2008,"Crime, Thriller",84,USA,English,Dave Meyers,"Eric Red, Jake Wade Wall",Focus Features,"Sean Bean, Sophia Bush, Zachary Knighton, Neal McDonough, Kyle Davis, Skip O'Brien, Travis Schuldt, Danny Bolero, Jeffrey Hutchinson, Yara Martinez, Lauren Cohn, Michael J. Fisher, Joe Self, Brad Robinson, Kurt Grossi",A serial killer pins his crimes on two college students who gave him a ride.,5.6,40111,"$10,000,000 ","$16,472,961 ",25399945.00,28,283,180
tt0112851,Desperado,Desperado,1995,2/9/1996,"Action, Crime, Thriller",104,"USA, Mexico","English, Spanish",Robert Rodriguez,Robert Rodriguez,Columbia Pictures,"Antonio Banderas, Salma Hayek, Joaquim de Almeida, Cheech Marin, Steve Buscemi, Carlos Gรณmez, Quentin Tarantino, Tito Larriva, Angel Aviles, Danny Trejo, Abraham Verduzco, Carlos Gallardo, Albert Michel Jr., David Alvarado, Angela Lanza",Former musician and gunslinger El Mariachi arrives at a small Mexican border town after being away for a long time. His past quickly catches up with him and he soon gets entangled with the local drug kingpin Bucho and his gang.,7.2,168748,"$7,000,000 ","$25,405,445 ",25405445.00,55,213,108
tt0094155,Tin Men - 2 imbroglioni con signora,Tin Men,1987,6/5/1987,"Comedy, Drama",112,USA,English,Barry Levinson,Barry Levinson,Bandai Films,"Richard Dreyfuss, Danny DeVito, Barbara Hershey, John Mahoney, Jackie Gayle, Stanley Brock, Seymour Cassel, Bruno Kirby, J.T. Walsh, Richard Portnow, Matt Craven, Alan Blumenfeld, Brad Sullivan, Michael Tucker, Deirdre O'Connell",A minor car accident drives two rival aluminum-siding salesmen to the ridiculous extremes of man versus man in 1963 Baltimore.,6.6,7742,"$11,000,000 ","$25,411,386 ",25411386.00,75,48,26
tt2465146,Mai cosรฌ vicini,And So It Goes,2014,7/10/2014,"Comedy, Drama, Romance",94,USA,English,Rob Reiner,Mark Andrus,ASIG Productions,"Michael Douglas, Diane Keaton, Sterling Jerins, Annie Parisse, Austin Lysy, Michael Terra, Sawyer Simpkins, Maxwell Simkins, Maurice Jones, Yaya DaCosta, Scott Shepherd, Andy Karl, Frances Sternhagen, Frankie Valli, Luke Robertson",A self-absorbed realtor enlists the help of his neighbor when he's suddenly left in charge of the granddaughter he never knew existed until his estranged son drops her off at his home.,5.8,12539,"$18,000,000 ","$15,160,801 ",25419147.00,38,63,115
tt0462322,Grindhouse,Grindhouse,2007,9/28/2007,"Action, Horror, Thriller",191,"USA, Canada","English, Spanish","Robert Rodriguez, Eli Roth","Robert Rodriguez, Rob Zombie",Dimension Films,"Kurt Russell, Zoรซ Bell, Rosario Dawson, Vanessa Ferlito, Sydney Tamiia Poitier, Tracie Thoms, Rose McGowan, Jordan Ladd, Mary Elizabeth Winstead, Quentin Tarantino, Marcy Harriell, Eli Roth, Omar Doom, Michael Bacall, Monica Staggs",Quentin Tarantino and Robert Rodriguez's homage to exploitation double features in the 60s and 70s with two back-to-back cult films that include previews of coming attractions between them.,7.5,176256,"$67,000,000 ","$25,037,897 ",25422088.00,77,534,259
tt0419198,La tigre e la neve,La tigre e la neve,2005,10/14/2005,"Comedy, Drama, Romance",114,Italy,"Italian, English, Arabic, French",Roberto Benigni,"Roberto Benigni, Vincenzo Cerami",Melampo Cinematografica,"Roberto Benigni, Jean Reno, Nicoletta Braschi, Tom Waits, Emilia Fox, Gianfranco Varetto, Giuseppe Battiston, Lucia Poli, Chiara Pirri, Anna Pirri, Andrea Renzi, Abdelhafid Metalsi, Amid Farid, Mohmed Hedi Bahri, Franco Barbero",A love-struck Italian poet is stuck in Iraq at the onset of an American invasion.,7.1,13299,"$35,000,000 ","$10,167 ",25460023.00,22,42,49
tt0116225,Fuga da Los Angeles,Escape from L.A.,1996,1/10/1997,"Action, Adventure, Sci-Fi",101,USA,English,John Carpenter,"John Carpenter, Nick Castle",Paramount Pictures,"Kurt Russell, Steve Buscemi, Peter Fonda, Cliff Robertson, Valeria Golino, Stacy Keach, Pam Grier, Bruce Campbell, Georges Corraface, Michelle Forbes, A.J. Langer, Ina Romeo, Peter Jason, Jordan Baker, Caroleen Feeney","Snake Plissken is once again called in by the United States government to recover a potential doomsday device from Los Angeles, now an autonomous island where undesirables are deported.",5.8,68450,"$50,000,000 ","$25,477,365 ",25477365.00,54,251,131
tt0119675,Mimic,Mimic,1997,5/22/1998,"Horror, Sci-Fi",105,"USA, Denmark","English, Italian",Guillermo del Toro,"Donald A. Wollheim, Matthew Robbins",Dimension Films,"Mira Sorvino, Jeremy Northam, Alexander Goodwin, Giancarlo Giannini, Charles S. Dutton, Josh Brolin, Alix Koromzay, F. Murray Abraham, James Costa, Javon Barnwell, Norman Reedus, Pak-Kwong Ho, Glenn Bang, Margaret Ma, Warna Fisher","Three years ago, entomologist Dr. Susan Tyler genetically created an insect to kill cockroaches carrying a virulent disease. Now, the insects are out to destroy their only predator, mankind.",5.9,45197,"$30,000,000 ","$25,480,490 ",25480490.00,55,180,139
tt0087800,Nightmare - Dal profondo della notte,A Nightmare on Elm Street,1984,11/16/1984,Horror,91,USA,English,Wes Craven,Wes Craven,New Line Cinema,"John Saxon, Ronee Blakley, Heather Langenkamp, Amanda Wyss, Jsu Garcia, Johnny Depp, Charles Fleischer, Joseph Whipp, Robert Englund, Lin Shaye, Joe Unger, Mimi Craven, Jack Shea, Ed Call, Sandy Lipton",The monstrous spirit of a slain child murderer seeks revenge by invading the dreams of teenagers whose parents were responsible for his untimely death.,7.5,200307,"$1,800,000 ","$25,504,513 ",25504513.00,76,791,216
tt0082495,Il signore della morte,Halloween II,1981,10/30/1981,Horror,92,USA,English,Rick Rosenthal,"John Carpenter, Debra Hill",Dino De Laurentiis Company,"Jamie Lee Curtis, Donald Pleasence, Charles Cyphers, Jeffrey Kramer, Lance Guest, Pamela Susan Shoop, Hunter von Leer, Dick Warlock, Leo Rossi, Gloria Gifford, Tawny Moyer, Ana Alicia, Ford Rainey, Cliff Emmich, Nancy Stephens","While Sheriff Brackett and Dr. Loomis hunt for Michael Myers, a traumatized Laurie is rushed to hospital, and the serial killer is not far behind her.",6.5,72460,"$2,500,000 ","$25,533,818 ",25533818.00,40,561,197
tt0095188,L'allegra fattoria,Funny Farm,1988,6/3/1988,Comedy,101,USA,English,George Roy Hill,"Jay Cronley, Jeffrey Boam",Cornelius Productions,"Chevy Chase, Madolyn Smith Osborne, Kevin O'Morrison, Joseph Maher, Jack Gilpin, Caris Corfman, William Severs, Mike Starr, Glenn Plummer, William Duell, Helen Lloyd Breed, Kit Le Fever, Dakin Matthews, William Newman, Alice Drummond","A couple swap city life for the country, but their picturesque new hometown turns out to be just a little bit different to what they were expecting.",6.2,19155,"$19,000,000 ","$25,537,221 ",25537221.00,50,85,26
tt1966359,2 gran figli di...,Father Figures,2017,3/1/2018,"Comedy, Drama",113,USA,English,Lawrence Sher,Justin Malen,Alcon Entertainment,"Robert Jon Mello, Ed Helms, Retta, Zachary Haven, Mary Grill, Glenn Close, Ann McKenzie, Owen Wilson, Jessica Gomes, Harry Shearer, Sarah Skeist, Jo Helton, Terry Bradshaw, Debra Stipe, Ving Rhames","Upon learning that their mother has been lying to them for years about their allegedly deceased father, two fraternal twin brothers hit the road in order to find him.",5.5,17279,"$25,000,000 ","$17,501,244 ",25601244.00,22,99,60
tt0127723,"Giovani, pazzi e svitati",Can't Hardly Wait,1998,7/30/1999,"Comedy, Romance",100,USA,English,"Harry Elfont, Deborah Kaplan","Deborah Kaplan, Harry Elfont",Columbia Pictures,"Jennifer Love Hewitt, Ethan Embry, Charlie Korsmo, Lauren Ambrose, Peter Facinelli, Seth Green, Michelle Brookhurst, Alexander Martin, Erik Palladino, Channon Roe, Sean Patrick Thomas, Freddy Rodrรญguez, Joel Michaely, Jay Paulson, Brian Hall",Multicharacter teenage comedy about high school graduates with different agenda of life on graduation night.,6.5,44922,"$10,000,000 ","$25,605,015 ",25605015.00,52,265,82
tt0298388,Jonah: Un film dei Verdurini,Jonah: A VeggieTales Movie,2002,10/4/2002,"Animation, Adventure, Comedy",82,"USA, UK",English,"Mike Nawrocki, Phil Vischer","Phil Vischer, Mike Nawrocki",Big Idea Productions,"Phil Vischer, Mike Nawrocki, Tim Hodge, Lisa Vischer, Shelby Morimoto, Dan Anderson, Kristin Blegen, Jim Poole, Ron Smith, Sarah Catherine Brooks, Adam Frick, Paige Craig, Michael Harrison, Amy Howard, Chris Geiger","When the singing Veggies encounter some car trouble, they are stranded at an old rundown seafood joint, where nothing is quite as it seems.",6.5,3819,"$14,000,000 ","$25,581,229 ",25621297.00,58,81,38
tt0088683,Agnese di Dio,Agnes of God,1985,9/27/1985,"Drama, Mystery",98,USA,"English, French, Latin",Norman Jewison,"John Pielmeier, John Pielmeier",Columbia Pictures,"Jane Fonda, Anne Bancroft, Meg Tilly, Anne Pitoniak, Winston Rekert, Gratien Gรฉlinas, Guy Hoffmann, Gabriel Arcand, Franรงoise Faucher, Jacques Tourangeau, Janine Fluet, Deborah Grover, Michele George, Samantha Langevin, Jacqueline Blais","When a naive novice nun is discovered with a dead newborn in her convent quarters, a court-appointed psychiatrist investigates her case.",6.6,6627,"$10,000,000 ","$25,627,836 ",25627836.00,52,52,30
tt9214832,Emma.,Emma.,2020,3/27/2020,"Comedy, Drama",124,UK,English,Autumn de Wilde,"Eleanor Catton, Jane Austen",Working Title Films,"Anya Taylor-Joy, Angus Imrie, Letty Thomas, Gemma Whelan, Bill Nighy, Aidan White, Edward Davis, Chris White, Rupert Graves, Miranda Hart, Myra McFadyen, Esther Coles, Suzy Bloom, Suzanne Toase, Nicholas Burns","In 1800s England, a well meaning but selfish young woman meddles in the love lives of her friends.",6.7,19858,"$10,000,000 ","$10,055,355 ",25659965.00,71,314,188
tt0086066,I ragazzi della 56ยช strada,The Outsiders,1983,10/21/1983,"Crime, Drama",91,"USA, France",English,Francis Ford Coppola,"Kathleen Rowell, S.E. Hinton",Zoetrope Studios,"C. Thomas Howell, Matt Dillon, Ralph Macchio, Patrick Swayze, Rob Lowe, Emilio Estevez, Tom Cruise, Glenn Withrow, Diane Lane, Leif Garrett, Darren Dalton, Michelle Meyrink, Tom Waits, Gailard Sartain, William Smith","The rivalry between two gangs, the poor Greasers and the rich Socs, only heats up when one gang member kills a member of the other.",7.1,73469,"$10,000,000 ","$25,697,647 ",25697647.00,41,361,43
tt1032755,RocknRolla,RocknRolla,2008,4/24/2009,"Action, Crime, Thriller",114,"UK, USA, France","English, Russian",Guy Ritchie,Guy Ritchie,Warner Bros.,"Gerard Butler, Tom Wilkinson, Thandie Newton, Mark Strong, Idris Elba, Tom Hardy, Karel Roden, Toby Kebbell, Jeremy Piven, Ludacris, Jimi Mistry, Matt King, Geoff Bell, Dragan Micanovic, Michael Ryan","When a Russian mobster orchestrates a crooked land deal, millions of dollars are up for grabs, drawing in the entire London underworld into a feeding frenzy at a time when the old criminal regime is losing turf to a wealthy foreign mob.",7.3,231863,"$18,000,000 ","$5,700,626 ",25740863.00,53,235,211
tt0103919,Candyman - Terrore dietro lo specchio,Candyman,1992,3/25/1993,"Horror, Thriller",99,"USA, UK",English,Bernard Rose,"Clive Barker, Bernard Rose",Candyman Films,"Virginia Madsen, Tony Todd, Xander Berkeley, Kasi Lemmons, Vanessa Williams, DeJuan Guy, Marianna Elliott, Ted Raimi, Ria Pavia, Mark Daniels, Lisa Ann Poggi, Adam Philipson, Eric Edwards, Carolyn Lowery, Barbara Alston","The Candyman, a murderous soul with a hook for a hand, is accidentally summoned to reality by a skeptic grad student researching the monster's myth.",6.6,68119,"$6,000,000 ","$25,792,310 ",25794159.00,61,269,168
tt1637706,Quell'idiota di nostro fratello,Our Idiot Brother,2011,7/4/2012,"Comedy, Drama",90,USA,English,Jesse Peretz,"Jesse Peretz, Evgenia Peretz",Big Beach Films,"Paul Rudd, Nick Sullivan, Francesca Papalia, Bob Stephenson, Elizabeth Banks, Peter Hermann, Adam Scott, Kelly Briter, Rashida Jones, Zooey Deschanel, Emily Mortimer, Steve Coogan, Kathryn Hahn, T.J. Miller, Shirley Knight",A comedy centered on an idealist who barges into the lives of his three sisters.,6.4,82978,"$5,000,000 ","$24,816,118 ",25804448.00,60,144,182
tt0119731,Delitto alla Casa Bianca,Murder at 1600,1997,12/5/1997,"Action, Crime, Drama",107,USA,English,Dwight H. Little,"Wayne Beach, David Hodgin",Warner Bros.,"Wesley Snipes, Diane Lane, Daniel Benzali, Dennis Miller, Alan Alda, Ronny Cox, Diane Baker, Tate Donovan, Harris Yulin, Tom Wright, Nicholas Pryor, Charles Rocket, Nigel Bennett, Tamara Gorski, Douglas O'Keeffe",A young woman is murdered in the White House. Homicide detective Regis (,6.1,28034,"$40,000,000 ","$25,804,707 ",25804707.00,47,66,61
tt0977855,Fair Game - Caccia alla spia,Fair Game,2010,10/22/2010,"Biography, Drama, Thriller",108,"USA, United Arab Emirates","English, Arabic, French",Doug Liman,"Jez Butterworth, John-Henry Butterworth",River Road Entertainment,"Naomi Watts, Sonya Davison, Vanessa Chong, Anand Tiwari, Stephanie Chai, Sean Penn, Ty Burrell, Jessica Hecht, Norbert Leo Butz, Rebecca Rigg, Brooke Smith, Tom McCarthy, Ashley Gerasimovich, Quinn Broggy, Nicholas Sadler",CIA operative Valerie Plame discovers her identity is allegedly leaked by the government as payback for an op-ed article her husband wrote criticizing the Bush administration.,6.8,46131,"$22,000,000 ","$9,540,691 ",25806953.00,69,150,214
tt2053425,Un sapore di ruggine e ossa,De rouille et d'os,2012,10/4/2012,"Drama, Romance",120,"France, Belgium, Singapore","French, English",Jacques Audiard,"Jacques Audiard, Thomas Bidegain",Why Not Productions,"Marion Cotillard, Matthias Schoenaerts, Armand Verdure, Cรฉline Sallette, Corinne Masiero, Bouli Lanners, Jean-Michel Correia, Yannick Choirat, Mourad Frarema, Fred Menut, Duncan Versteegh, Katia Chaperon, Catherine Fa, Andรจs Lopez Jabois, Ocรฉane Cartia","Put in charge of his young son, Alain leaves Belgium for Antibes to live with his sister and her husband as a family. Alain's bond with Stephanie, a killer whale trainer, grows deeper after Stephanie suffers a horrible accident.",7.5,62551,EUR 15400000,"$2,062,027 ",25807712.00,73,107,351
tt0318974,Alamo - Gli ultimi eroi,The Alamo,2004,6/25/2004,"Drama, History, War",137,USA,"English, Spanish",John Lee Hancock,"Leslie Bohem, Stephen Gaghan",Touchstone Pictures,"Dennis Quaid, Billy Bob Thornton, Jason Patric, Patrick Wilson, Emilio Echevarrรญa, Jordi Mollร , Leon Rippy, Tom Davidson, Marc Blucas, Robert Prentiss, Kevin Page, Joe Stevens, Stephen Bruton, Laura Clifton, Ricardo Chavira","Based on the 1836 standoff between a group of Texan and Tejano men, led by Davy Crockett and Jim Bowie, and Mexican dictator Santa Anna's forces at the Alamo in San Antonio Texas.",6,19363,"$107,000,000 ","$22,414,961 ",25819961.00,47,306,100
tt0116367,Dal tramonto all'alba,From Dusk Till Dawn,1996,1/3/1997,"Action, Crime, Horror",108,"USA, Mexico","English, Spanish",Robert Rodriguez,"Robert Kurtzman, Quentin Tarantino",Dimension Films,"George Clooney, Quentin Tarantino, Harvey Keitel, Juliette Lewis, Ernest Liu, Salma Hayek, Cheech Marin, Danny Trejo, Tom Savini, Fred Williamson, Michael Parks, Brenda Hillhouse, John Saxon, Marc Lawrence, Kelly Preston","Two criminals and their hostages unknowingly seek temporary refuge in a truck stop populated by vampires, with chaotic results.",7.2,281205,"$19,000,000 ","$25,836,616 ",25836616.00,48,667,197
tt0204175,Boys & girls - Attenzione: il sesso cambia tutto,Boys and Girls,2000,6/8/2001,"Comedy, Drama, Romance",94,USA,English,Robert Iscove,"Andrew Lowery, Andrew Miller",Punch 21 Productions,"Brendon Ryan Barrett, Gay Thomas Wilson, Raquel Beaudene, Claire Forlani, David Smigelski, Blake Shields, Freddie Prinze Jr., Alyson Hannigan, Jason Biggs, Amanda Detmer, Sean Maysonet, John X, Tsianina Joelson, Kristofer Mickelson, Matt Carmody",A friendship is put to the ultimate test when two best friends wind up in bed together.,5.4,15812,"$35,000,000 ","$21,799,652 ",25850615.00,29,131,67
tt0246894,Rollerball,Rollerball,2002,3/29/2002,"Action, Sci-Fi, Sport",98,"USA, Germany, Japan","English, Russian, French, Arabic, Korean, German, Japanese",John McTiernan,"William Harrison, William Harrison",Atlas Entertainment,"Chris Klein, Jean Reno, LL Cool J, Rebecca Romijn, Naveen Andrews, Oleg Taktarov, David Hemblen, Janet Wright, Andrew Bryniarski, Kata Dobรณ, Alice Poon, Lucia Rijker, Melissa R. Stubbs, Paul Wu, Yolanda Hughes-Heying",The big thing in 2005 is a violent sport which can have some pretty serious consequences... like dying.,3.1,25432,"$70,000,000 ","$18,990,798 ",25852764.00,14,297,156
tt0093260,Salto nel buio,Innerspace,1987,12/18/1987,"Action, Adventure, Comedy",120,USA,English,Joe Dante,"Chip Proser, Jeffrey Boam",Warner Bros.,"Dennis Quaid, Martin Short, Meg Ryan, Kevin McCarthy, Fiona Lewis, Vernon Wells, Robert Picardo, Wendy Schaal, Harold Sylvester, William Schallert, Henry Gibson, John Hora, Mark L. Taylor, Orson Bean, Kevin Hooks","A test pilot is miniaturized in a secret experiment, and accidentally injected into a hapless store clerk.",6.8,53141,"$27,000,000 ","$25,893,810 ",25893810.00,66,95,79
tt7388562,"Paolo, apostolo di Cristo","Paul, Apostle of Christ",2018,3/23/2018,"Adventure, Biography, Drama",108,USA,English,Andrew Hyatt,"Terence Berden, Andrew Hyatt",Affirm Films,"Jim Caviezel, James Faulkner, Olivier Martinez, Joanne Whalley, John Lynch, Yorgos Karamihos, Antonia Campbell-Hughes, Alessandro Sperduti, Avery Grant, Manuel Cauchi, Noah Huntley, Kenneth Spiteri, Anthony Edridge, Andrรฉ Agius, John-Paul Pace","Luke travels Roma looking for apostle Paul, turned in Nero's prisoner, to tell his story before his execution.",6.6,6953,"$5,000,000 ","$17,560,475 ",25915966.00,52,109,34
tt0087089,Cotton Club,The Cotton Club,1984,12/22/1984,"Crime, Drama, Music",127,USA,"English, Italian",Francis Ford Coppola,"William Kennedy, Francis Ford Coppola",Zoetrope Studios,"Richard Gere, Gregory Hines, Diane Lane, Lonette McKee, Bob Hoskins, James Remar, Nicolas Cage, Allen Garfield, Fred Gwynne, Gwen Verdon, Lisa Jane Persky, Maurice Hines, Julian Beck, Novella Nelson, Laurence Fishburne","Meet the jazz musicians, dancers, owner and guests (e.g. gangster Dutch Schultz) of The Cotton Club in 1928-30s Harlem.",6.5,16083,"$58,000,000 ","$25,928,721 ",25928721.00,68,98,39
tt4537896,Cocaine - La vera storia di White Boy Rick,White Boy Rick,2018,3/7/2019,"Crime, Drama",111,USA,English,Yann Demange,"Andy Weiss, Logan Miller",LBI Productions,"Matthew McConaughey, Richie Merritt, Bel Powley, Jennifer Jason Leigh, Brian Tyree Henry, Rory Cochrane, RJ Cyler, Jonathan Majors, Eddie Marsan, Taylour Paige, Bruce Dern, Piper Laurie, Raekwon Haynes, Ishmael Ali, James Howard","The story of teenager Richard Wershe Jr., who became an undercover informant for the FBI during the 1980s and was ultimately arrested for drug-trafficking and sentenced to life in prison.",6.4,24478,"$29,000,000 ","$24,011,188 ",25957482.00,59,192,125
tt2547584,La luce sugli oceani,The Light Between Oceans,2016,3/8/2017,"Drama, Romance",133,"UK, New Zealand, USA, India, Australia",English,Derek Cianfrance,"Derek Cianfrance, M.L. Stedman",Heyday Films,"Michael Fassbender, Alicia Vikander, Rachel Weisz, Florence Clery, Jack Thompson, Thomas Unger, Jane Menelaus, Garry McDonald, Anthony Hayes, Benedict Hardie, Emily Barclay, Bryan Brown, Stephen Ure, Peter McCauley, Leon Ford",A lighthouse keeper and his wife living off the coast of Western Australia raise a baby they rescue from a drifting rowing boat.,7.2,50689,"$20,000,000 ","$12,545,979 ",25975621.00,60,170,256
tt0420087,Radio America,A Prairie Home Companion,2006,6/1/2006,"Comedy, Drama, Music",105,USA,"English, Norwegian",Robert Altman,"Garrison Keillor, Garrison Keillor",Picturehouse,"Marylouise Burke, Woody Harrelson, L.Q. Jones, Tommy Lee Jones, Garrison Keillor, Kevin Kline, Lindsay Lohan, Virginia Madsen, John C. Reilly, Maya Rudolph, Tim Russell, Sue Scott, Meryl Streep, Lily Tomlin, Tom Keith","A look at what goes on backstage during the last broadcast of America's most celebrated radio show, where singing cowboys Dusty and Lefty, a country music siren, and a host of others hold court.",6.7,21686,"$10,000,000 ","$20,342,852 ",25986497.00,75,281,208
tt0804452,Bratz,Bratz,2007,6/6/2008,"Comedy, Family, Music",110,USA,"English, Spanish",Sean McNamara,"Susan Estelle Jansen, Adam De La Peรฑa",Avi Arad & Associates,"Logan Browning, Janel Parrish, Nathalia Ramos, Skyler Shaye, Chelsea Kane, Anneliese van der Pol, Melise, Ian Nelson, Stephen Ford, Jon Voight, Lainie Kazan, William May, Emily Rose Everhard, Chet Hanks, Carl Rux","During their first year of high school, four best girlfriends face off against the domineering student body President, who wants to split them up into different social cliques.",3.1,17575,"$20,000,000 ","$10,010,209 ",26013153.00,21,118,61
tt0080678,The Elephant Man,The Elephant Man,1980,3/12/1981,"Biography, Drama",124,"USA, UK","English, French",David Lynch,"Christopher De Vore, Eric Bergren",Brooksfilms,"Anthony Hopkins, John Hurt, Anne Bancroft, John Gielgud, Wendy Hiller, Freddie Jones, Michael Elphick, Hannah Gordon, Helen Ryan, John Standing, Dexter Fletcher, Lesley Dunlop, Phoebe Nicholls, Pat Gorman, Claire Davenport","A Victorian surgeon rescues a heavily disfigured man who is mistreated while scraping a living as a side-show freak. Behind his monstrous faรงade, there is revealed a person of kindness, intelligence and sophistication.",8.1,214473,"$5,000,000 ","$26,010,864 ",26020641.00,78,420,149
