imdb_title_id,title,original_title,year,date_published,genre,duration,country,language,director,writer,production_company,actors,description,avg_vote,votes,budget,usa_gross_income,worlwide_gross_income,metascore,reviews_from_users,reviews_from_critics
tt0313792,Anything Else,Anything Else,2003,10/3/2003,"Comedy, Romance",108,"USA, France, UK","English, Latin",Woody Allen,Woody Allen,DreamWorks,"Woody Allen, Jason Biggs, Fisher Stevens, Anthony Arkin, Danny DeVito, Christina Ricci, KaDee Strickland, Jimmy Fallon, Diana Krall, William Hill, Stockard Channing, Maurice Sonnenberg, Kenneth Edelson, David Conrad, Joseph Lyle Taylor",Jerry Falk (,6.3,29339,"$18,000,000 ","$3,212,310 ",13585075.00,43,166,106
tt0106627,La ragazza della porta accanto,The Crush,1993,4/2/1993,"Drama, Thriller",89,USA,English,Alan Shapiro,Alan Shapiro,Morgan Creek Entertainment,"Cary Elwes, Alicia Silverstone, Jennifer Rubin, Kurtwood Smith, Amber Benson, Gwynyth Walsh, Matthew Walker, Deborah Hancock, Beverley Elliott, Andrew Airlie, Sheila Paterson, Brent Chapman, James Kidnie, Betty Phillips, Duncan Fraser","A journalist becomes the unwanted center of attention for a 14-year-old girl, who proceeds to sabotage his life after he refuses her sexual advances.",5.9,16024,"$6,000,000 ","$13,609,396 ",13609396.00,34,88,40
tt0815244,Sydney White - Biancaneve al college,Sydney White,2007,9/21/2007,"Comedy, Drama, Romance",108,USA,English,Joe Nussbaum,Chad Gomez Creasey,Morgan Creek Entertainment,"Amanda Bynes, Sara Paxton, Matt Long, Jack Carpenter, Jeremy Howard, Crystal Hunt, Adam Hendershott, Danny Strong, Samm Levine, Libby Mintz, John Schneider, Arnie Pantoja, Dontรฉ Bonner, Brian Patrick Clarke, Lauren Leech",A modern retelling of Snow White set against students in their freshman year of college in the greek system.,6.2,45476,"$16,500,000 ","$11,892,415 ",13620075.00,45,57,71
tt2017038,All Is Lost - Tutto รจ perduto,All Is Lost,2013,2/6/2014,"Action, Adventure, Drama",106,USA,English,J.C. Chandor,J.C. Chandor,Roadside Attractions,Robert Redford,"After a collision with a shipping container at sea, a resourceful sailor finds himself, despite all efforts to the contrary, staring his mortality in the face.",6.9,74976,"$9,000,000 ","$6,263,670 ",13627519.00,87,396,370
tt1352824,Chloe - Tra seduzione e inganno,Chloe,2009,3/12/2010,"Drama, Mystery, Romance",96,"USA, Canada, France",English,Atom Egoyan,"Erin Cressida Wilson, Anne Fontaine",StudioCanal,"Julianne Moore, Liam Neeson, Amanda Seyfried, Max Thieriot, R.H. Thomson, Nina Dobrev, Mishu Vellani, Julie Khaner, Laura de Carteret, Natalie Lisinska, Tiffany Lyndall-Knight, Meghan Heffern, Tamsen McDonough, Kathryn Kriitmaa, Arlene Duncan","Suspecting her husband of infidelity, gynecologist Dr. Catherine Stewart hires an escort named Chloe in order to test his faithfulness. Soon, the relationships between all three intensify.",6.3,68304,"$14,000,000 ","$3,075,255 ",13657649.00,48,191,222
tt0244000,Gli ultimi fuorilegge,American Outlaws,2001,3/1/2002,"Action, Western",94,USA,English,Les Mayfield,"Roderick Taylor, Roderick Taylor",Morgan Creek Entertainment,"Colin Farrell, Scott Caan, Ali Larter, Gabriel Macht, Gregory Smith, Harris Yulin, Kathy Bates, Timothy Dalton, Will McCormack, Ronny Cox, Terry O'Quinn, Nathaniel Arcand, Ty O'Neal, Joe Stevens, Barry Tubb",5 Southern friends return home when the war ends 1865. But Yankee soldiers and Pinkerton are busy helping a railroad baron grab land from farmers along the planned railroad west. The 5 friends fight back.,6,13782,"$35,000,000 ","$13,342,790 ",13678913.00,25,169,44
tt9779516,Cosa mi lasci di te,I Still Believe,2020,3/19/2020,"Biography, Drama, Music",116,USA,English,"Andrew Erwin, Jon Erwin","Jeremy Camp, Jon Erwin",Kevin Downes Productions,"K.J. Apa, Britt Robertson, Nathan Parsons, Gary Sinise, Shania Twain, Reuben Dodd, Nicolas Bechtel, Melissa Roxburgh, Terry Serpico, Tanya Christiansen, Cameron Arnett, Abigail Cowen, Rushi Birudala, Anjelah Johnson-Reyes, Mike McGill",The true-life story of Christian music star Jeremy Camp and his journey of love and loss that looks to prove there is always hope.,6.5,6196,"$12,000,000 ","$9,868,521 ",13681524.00,41,151,52
tt0113987,Gli intrighi del potere - Nixon,Nixon,1995,3/29/1996,"Biography, Drama, History",192,USA,"English, Mandarin, Russian",Oliver Stone,"Stephen J. Rivele, Christopher Wilkinson",Cinergi Pictures Entertainment,"Anthony Hopkins, Joan Allen, Powers Boothe, Ed Harris, Bob Hoskins, E.G. Marshall, David Paymer, David Hyde Pierce, Paul Sorvino, Mary Steenburgen, J.T. Walsh, James Woods, Brian Bedford, Kevin Dunn, Fyvush Finkel",A biographical story of former U.S. President,7.1,28317,"$44,000,000 ","$13,681,765 ",13681765.00,66,171,79
tt0430431,Una notte con il re,One Night with the King,2006,10/13/2006,"Biography, Drama, History",123,USA,English,Michael O. Sajbel,"Stephan Blinn, Mark Andrew Olsen",Gener8Xion Entertainment,"Tiffany Dupont, Luke Goss, John Noble, Omar Sharif, John Rhys-Davies, Tommy 'Tiny' Lister, James Callis, Peter O'Toole, Javen Campbell, Jyoti Dogra, Indraneel Bhattacharya, Jonah Lotan, Dilshad Patel, Nimrat Kaur, Takesh Singh","In Biblical times, a girl disguises her Jewish origins when the Persian king comes looking for a new bride among his subjects.",6.1,6663,"$20,000,000 ","$13,395,961 ",13728450.00,38,182,37
tt0213790,The Ladies Man,The Ladies Man,2000,10/13/2000,Comedy,84,USA,English,Reginald Hudlin,"Tim Meadows, Dennis McNicholas",Broadway Pictures,"Tim Meadows, Karyn Parsons, Billy Dee Williams, John Witherspoon, Jill Talley, Lee Evans, Will Ferrell, Sofia Milos, Eugene Levy, David Huband, Jammer, Ken Hudson Campbell, Kevin McDonald, Tamala Jones, Julianne Moore",The,5.2,12293,"$24,000,000 ","$13,616,610 ",13743212.00,22,86,56
tt1399683,Un gelido inverno,Winter's Bone,2010,2/18/2011,"Drama, Mystery",100,USA,English,Debra Granik,"Debra Granik, Anne Rosellini",Anonymous Content,"Jennifer Lawrence, Isaiah Stone, Ashlee Thompson, Valerie Richards, Shelley Waggener, Garret Dillahunt, William White, Ramona Blair, Lauren Sweetser, Andrew Burnley, Phillip Burnley, Isaac Skidmore, Cody Brown, Cinnamon Schultz, John Hawkes",An unflinching Ozark Mountain girl hacks through dangerous social terrain as she hunts down her drug-dealing father while trying to keep her family intact.,7.2,133783,"$2,000,000 ","$6,531,503 ",13796834.00,90,350,235
tt0247444,Juwanna Mann,Juwanna Mann,2002,11/29/2002,"Comedy, Drama, Romance",91,USA,English,Jesse Vaughan,Bradley Allenstein,Morgan Creek Entertainment,"Miguel A. Nรบรฑez Jr., Vivica A. Fox, Kevin Pollak, Tommy Davidson, Kim Wayans, Jenifer Lewis, Ginuwine, Lil' Kim, Annie Corley, Tammi Reiss, Heather Quella, Angie Cossey, Itoro Coleman, Terry Loughlin, Bonnie Johnson","A basketball star is booted out of the NBA when his on-court antics go too far, so he poses as a woman and joins the WUBA.",4.6,6257,"$15,600,000 ","$13,670,733 ",13802599.00,24,42,30
tt0317676,House of the Dead,House of the Dead,2003,7/23/2004,"Action, Adventure, Horror",90,"Germany, Canada, USA",English,Uwe Boll,"Mark A. Altman, Dan Bates",Boll Kino Beteiligungs GmbH & Co. KG,"Jonathan Cherry, Tyron Leitso, Clint Howard, Ona Grauer, Ellie Cornell, Will Sanderson, Enuka Okuma, Kira Clavell, Sonya Salomaa, Michael Eklund, David Palffy, Jรผrgen Prochnow, Steve Byers, Erica Durance, Birgit Stein","A group of college students travels to a mysterious island to attend a rave, which is soon taken over by bloodthirsty zombies.",2,35615,"$12,000,000 ","$10,249,719 ",13818181.00,15,596,144
tt0095765,Nuovo Cinema Paradiso,Nuovo Cinema Paradiso,1988,11/17/1988,Drama,155,"Italy, France",Italian,Giuseppe Tornatore,"Giuseppe Tornatore, Giuseppe Tornatore",Cristaldifilm,"Antonella Attili, Enzo Cannavale, Isa Danieli, Leo Gullotta, Marco Leonardi, Pupella Maggio, Agnese Nano, Leopoldo Trieste, Salvatore Cascio, Tano Cimarosa, Nicola Di Pinto, Roberta Lena, Nino Terzo, Jacques Perrin, Philippe Noiret",A filmmaker recalls his childhood when falling in love with the pictures at the cinema of his home village and forms a deep friendship with the cinema's projectionist.,8.5,223050,"$5,000,000 ","$12,397,210 ",13826605.00,80,514,117
tt6523720,The Quake - Il terremoto del secolo,Skjelvet,2018,8/8/2019,"Action, Drama, Thriller",106,Norway,Norwegian,John Andreas Andersen,"John Kรฅre Raake, Harald Rosenlรธw-Eeg",Fantefilm,"Kristoffer Joner, Ane Dahl Torp, Edith Haagenrud-Sande, Kathrine Thorborg Johansen, Jonas Hoff Oftebro, Stig R. Amdam, Catrin Sagen, Per Frisch, Hanna Skogstad, Runar Dรธving, Agnes Bryhn Rรธysamb, David Kosek, Fredrik Skavlan, Ravdeep Singh Bajwa, Ingvild Haugstad","In 1904 an earthquake of magnitude 5.4 on the Richter scale shook Oslo, with an epicenter in the ""Oslo Graben"" which runs under the Norwegian capital. There are now signs that indicate that we can expect a major future earthquake in Oslo.",6.2,8954,NOK 52100000,"$6,235 ",13837294.00,70,98,65
tt0101775,Va' all'inferno Fred,Drop Dead Fred,1991,5/24/1991,"Comedy, Drama, Fantasy",103,"USA, UK",English,Ate de Jong,"Elizabeth Livingston, Carlos Davis",PolyGram Filmed Entertainment,"Phoebe Cates, Rik Mayall, Marsha Mason, Tim Matheson, Carrie Fisher, Keith Charles, Ashley Peldon, Daniel Gerroll, Ron Eldard, Eleanor Mondale, Bob Reid, Peter Thoemke, Sjoukje De Jong Douma, Paul Holmes, Steve Cochran",A young woman finds her already unstable life rocked by the presence of a rambunctious imaginary friend from childhood.,6,26469,"$6,788,000 ","$13,878,334 ",13878334.00,25,185,20
tt0301199,Piccoli affari sporchi,Dirty Pretty Things,2002,9/12/2003,"Crime, Drama, Thriller",97,UK,"English, Somali, Spanish, French",Stephen Frears,Steven Knight,BBC Films,"Chiwetel Ejiofor, Audrey Tautou, Sergi Lรณpez, Sophie Okonedo, Benedict Wong, Zlatko Buric, Kriss Dosanjh, Israel Oyelumade, Yemi Goodman Ajibade, Nizwar Karanj, Deobia Oparei, Jeffery Kissoon, Kenan Hudaverdi, Damon Younger, Paul Bhattacharjee",Undocumented immigrants Okwe and Senay work at a posh London hotel and live in constant fear of deportation. One night Okwe stumbles across evidence of a bizarre murder setting off a series of events that could lead to disaster or freedom.,7.3,40163,"$10,000,000 ","$8,112,414 ",13904766.00,78,223,145
tt0091369,Labyrinth - Dove tutto รจ possibile,Labyrinth,1986,12/23/1986,"Adventure, Family, Fantasy",101,"UK, USA",English,Jim Henson,"Dennis Lee, Jim Henson",Henson Associates (HA),"David Bowie, Jennifer Connelly, Toby Froud, Shelley Thompson, Christopher Malcolm, Natalie Finland, Shari Weiser, Brian Henson, Ron Mueck, Rob Mills, Dave Goelz, David Alan Barclay, David Shaughnessy, Karen Prell, Timothy Bateson",Sixteen-year-old Sarah is given thirteen hours to solve a labyrinth and rescue her baby brother Toby when her wish for him to be taken away is granted by the Goblin King Jareth.,7.4,121281,"$25,000,000 ","$13,723,253 ",13907620.00,50,555,147
tt0365830,Tenacious D e il destino del rock,Tenacious D in The Pick of Destiny,2006,2/23/2007,"Adventure, Comedy, Music",93,"USA, Germany",English,Liam Lynch,"Jack Black, Kyle Gass",Red Hour Films,"Jack Black, Kyle Gass, JR Reed, Ronnie James Dio, Paul F. Tompkins, Troy Gentile, Ned Bellamy, Fred Armisen, Kirk Ward, Amy Poehler, Tim Robbins, Dave Grohl, Ben Stiller, Lara Everly, Brittany Eldridge","To become the greatest band of all time, two slacker, wannabe-rockers set out on a quest to steal a legendary guitar pick that gives its holders incredible guitar skills, from a maximum security Rock and Roll museum.",6.8,100424,"$20,000,000 ","$8,334,575 ",13939963.00,55,209,127
tt0084335,Missing - Scomparso,Missing,1982,9/9/1982,"Biography, Drama, History",122,"USA, Mexico","English, Spanish, French",Costa-Gavras,"Costa-Gavras, Donald E. Stewart",PolyGram Filmed Entertainment,"Jack Lemmon, Sissy Spacek, Melanie Mayron, John Shea, Charles Cioffi, David Clennon, Richard Venture, Jerry Hardin, Richard Bradford, Joe Regalbuto, Keith Szarabajka, John Doolittle, Janice Rule, Ward Costello, Hansford Rowe","When an idealistic American writer disappears during the Chilean coup d'รฉtat in September 1973, his wife and father try to find him.",7.7,18117,"$9,500,000 ","$14,000,000 ",14000000.00,78,104,75
tt0092796,Creepshow 2,Creepshow 2,1987,8/28/1987,"Fantasy, Horror",92,USA,English,Michael Gornick,"Stephen King, George A. Romero",New World Pictures,"Domenick John, Tom Savini, George Kennedy, Philip Dore, Maltby Napoleon, Tyrone Tonto, Dorothy Lamour, Frank Salsedo, Holt McCallany, David Holbrook, Don Harvey, Dan Kamin, Dean Smith, Shirley Sonderegger, Paul Satterfield","Three more bone-chilling tales that include a vengeful wooden Native American, a monstrous blob in a lake, and a hitchhiker who wants revenge and will not die.",6.1,21923,"$3,500,000 ","$14,000,000 ",14000000.00,39,137,126
tt0228333,Fantasmi da Marte,Ghosts of Mars,2001,9/7/2001,"Action, Horror, Sci-Fi",98,USA,English,John Carpenter,"Larry Sulkis, John Carpenter",Screen Gems,"Natasha Henstridge, Ice Cube, Jason Statham, Clea DuVall, Pam Grier, Joanna Cassidy, Richard Cetrone, Rosemary Forsyth, Liam Waite, Duane Davis, Lobo Sebastian, Rodney A. Grant, Peter Jason, Wanda De Jesus, Doug McGrath","In 2176, a Martian police unit is sent to pick up a highly dangerous criminal at a remote mining post. Upon arrival, the cops find that the post has become a charnel house.",4.9,50317,"$28,000,000 ","$8,709,640 ",14010832.00,35,477,92
tt0160401,In Too Deep,In Too Deep,1999,8/25/1999,"Crime, Thriller, Drama",95,USA,English,Michael Rymer,"Michael Henry Brown, Paul Aaron",Dimension Films,"Omar Epps, LL Cool J, Nia Long, Stanley Tucci, Hill Harper, Jake Weber, Richard Brooks, David Patrick Kelly, Pam Grier, Veronica Webb, Ron Canada, Robert LaSardo, Gano Grills, Ivonne Coll, Don Harvey",Jeff Cole is a recent graduate of the Cincinnati police academy who dreams of working undercover. His wish is granted and through success is given the task of taking down state-wide crack ...,6.3,5739,"$7,000,000 ","$14,011,454 ",14011454.00,53,31,31
tt0181739,Osmosis Jones,Osmosis Jones,2001,8/10/2001,"Animation, Action, Adventure",95,USA,English,"Bobby Farrelly, Peter Farrelly",Marc Hyman,Warner Bros.,"Chris Rock, Laurence Fishburne, David Hyde Pierce, Brandy Norwood, William Shatner, Ron Howard, Kid Rock, Kenny Olson, Jason Krause, Joe C., Stefanie Eulinberg, Jimmie Bones, Uncle Kracker, Jonathan Adams, Carlos Alazraqui","A policeman white blood cell, with the help of a cold pill, must stop a deadly virus from destroying the human they live in, Frank.",6.3,31815,"$70,000,000 ","$13,596,911 ",14026418.00,57,155,79
tt0086143,American College,Private School,1983,7/29/1983,"Comedy, Romance",89,USA,English,Noel Black,"Dan Greenburg, Suzanne O'Malley",Unity Productions,"Phoebe Cates, Betsy Russell, Matthew Modine, Michael Zorek, Fran Ryan, Kathleen Wilhoite, Ray Walston, Sylvia Kristel, Jonathan Prince, Kari Lizer, Richard Stahl, Julie Payne, Frank Aletter, Frances Bay, Bill Wray",Chris from a girls' boarding school loves Jim from a nearby boys' boarding school. Jordan also wants Jim and plays dirty. Jim and 2 friends visit the girls' school posing as girls.,5.3,5726,"$3,500,000 ","$14,049,540 ",14049540.00,25,65,23
tt0083630,Kaan principe guerriero,The Beastmaster,1982,8/20/1982,"Action, Adventure, Fantasy",118,"USA, West Germany",English,Don Coscarelli,"Don Coscarelli, Paul Pepperman",Leisure Investment Company,"Marc Singer, Tanya Roberts, Rip Torn, John Amos, Joshua Milrad, Rod Loomis, Ben Hammer, Ralph Strait, Billy Jayne, Janet DeMay, Christine Kellogg, Janet Jones, Tony Epper, Vanna Bonta, Kim Tabet","A sword-and-sorcery fantasy about a young man's search for revenge. Armed with supernatural powers, the handsome hero and his animal allies wage war against marauding forces.",6.2,20053,"$8,000,000 ","$14,056,528 ",14056528.00,18,115,57
tt0115571,The Arrival,The Arrival,1996,5/31/1996,"Sci-Fi, Thriller",115,"USA, Mexico",English,David Twohy,David Twohy,Live Entertainment,"Charlie Sheen, Lindsay Crouse, Richard Schiff, Shane, Ron Silver, Teri Polo, Phyllis Applegate, Alan Coates, Leon Rippy, Buddy Joe Hooker, Javier Morga, Tony T. Johnson, Catalina Botello, Georg Lillitsch, David Villalpando","Zane, an astronomer, discovers intelligent alien life. But the aliens are keeping a deadly secret, and will do anything to stop Zane from learning it.",6.3,31449,"$25,000,000 ","$14,063,331 ",14063331.00,56,135,64
tt1214962,Solo per vendetta,Seeking Justice,2011,9/2/2011,"Action, Crime, Drama",105,USA,English,Roger Donaldson,"Todd Hickey, Robert Tannen",Endgame Entertainment,"Nicolas Cage, January Jones, Guy Pearce, Harold Perrineau, Jennifer Carpenter, Irone Singleton, Wayne Pรฉre, Xander Berkeley, Marcus Lyle Brown, Dikran Tulaine, Joe Chrest, Demetrius Bridges, Jason Davis, Brett Gentile, Renwick D. Scott II","After his wife is assaulted, a husband enlists the services of a vigilante group to help him settle the score. Then he discovers they want a 'favor' from him in return.",6.2,44195,"$17,000,000 ","$411,746 ",14089528.00,38,118,128
tt0083833,A cena con gli amici,Diner,1982,3/7/1986,"Comedy, Drama",110,USA,English,Barry Levinson,Barry Levinson,Metro-Goldwyn-Mayer (MGM),"Steve Guttenberg, Daniel Stern, Mickey Rourke, Kevin Bacon, Tim Daly, Ellen Barkin, Paul Reiser, Kathryn Dowling, Michael Tucker, Jessica James, Colette Blonigan, Kelle Kipp, John Aquino, Richard Pierson, Claudia Cron",A group of college-age buddies struggle with their imminent passage into adulthood in 1959 Baltimore.,7.1,18232,"$5,000,000 ","$14,099,953 ",14099953.00,82,94,50
tt1247640,Banlieue 13: Ultimatum,Banlieue 13: Ultimatum,2009,2/18/2009,"Action, Crime, Thriller",101,France,"French, English",Patrick Alessandrin,Luc Besson,EuropaCorp,"Cyril Raffaelli, David Belle, Philippe Torreton, Daniel Duval, Elodie Yung, MC Jean Gab'1, James Deano, Laouni Mouhid, Fabrice Feltzinger, Pierre-Marie Mosconi, Johnny Amaro, Pascal D'Amato, Guy Amram, Pascal Aubert, Jean-Gilles Barbier","Damien and Leito return to District 13 on a mission to bring peace to the troubled sector that is controlled by five different gang bosses, before the city's secret services take drastic measures to solve the problem.",6.5,42535,EUR 12000000,"$36,136 ",14103752.00,64,47,119
tt1748179,Red Lights,Red Lights,2012,11/8/2012,"Drama, Fantasy, Horror",114,"Spain, Canada",English,Rodrigo Cortรฉs,Rodrigo Cortรฉs,Millennium Films,"Cillian Murphy, Sigourney Weaver, Robert De Niro, Toby Jones, Joely Richardson, Elizabeth Olsen, Craig Roberts, Leonardo Sbaraglia, Adriane Lenox, Garrick Hagon, Burn Gorman, Mitchell Mullen, Nathan Osgood, Madeleine Potter, Eloise Webb","Psychologist Margaret Matheson and her assistant study paranormal activity, which leads them to investigate a world-renowned psychic who has resurfaced years after his toughest critic mysteriously passed away.",6.2,57838,EUR 14000000,"$52,624 ",14107313.00,36,172,199
tt0082288,Il drago del lago di fuoco,Dragonslayer,1981,6/26/1981,"Action, Adventure, Fantasy",108,"USA, UK",English,Matthew Robbins,"Hal Barwood, Matthew Robbins",Paramount Pictures,"Peter MacNicol, Caitlin Clarke, Ralph Richardson, John Hallam, Peter Eyre, Albert Salmi, Sydney Bromley, Chloe Salaman, Emrys James, Roger Kemp, Ian McDiarmid, Ken Shorter, Jason White, Yolande Palfrey, Douglas Cooper",A young wizarding apprentice is sent to kill a dragon which has been devouring girls from a nearby kingdom.,6.7,14686,"$18,000,000 ","$14,110,013 ",14110013.00,68,126,75
tt0104009,Fuga dal mondo dei sogni,Cool World,1992,4/15/1993,"Animation, Comedy, Fantasy",102,USA,English,Ralph Bakshi,"Michael Grais, Mark Victor",Bakshi Animation,"Janni Brenn, Brad Pitt, William Frankfather, Greg Collins, Maurice LaMarche, Gabriel Byrne, Joey Camen, Kim Basinger, Michael David Lally, Michele Abrams, Carrie Hamilton, Stephen Worth, Murray Podwal, Jenine Jennings, Gregory Snegoff",A comic strip femme fatale seeks to seduce her cartoonist creator in order to cross over into the real world.,4.9,20371,"$30,000,000 ","$14,110,589 ",14110589.00,28,102,50
tt0095889,Poltergeist III,Poltergeist III,1988,8/26/1988,"Horror, Thriller",98,USA,English,Gary Sherman,"Gary Sherman, Brian Taggert",Metro-Goldwyn-Mayer (MGM),"Tom Skerritt, Nancy Allen, Heather O'Rourke, Zelda Rubinstein, Lara Flynn Boyle, Kipley Wentz, Richard Fire, Nathan Davis, Roger May, Paul Graham, Meg Weldon, Stacy Gilchrist, Joey Garfield, Christian Murphy, Roy Hytower","Carol Anne is staying with her aunt in a high-rise building, where the supernatural forces haunting her make their return.",4.7,16524,"$10,500,000 ","$14,114,488 ",14114488.00,40,127,79
tt0181151,Da che pianeta vieni?,What Planet Are You From?,2000,12/1/2000,"Comedy, Sci-Fi",105,USA,English,Mike Nichols,"Garry Shandling, Michael Leeson",Brillstein-Grey Entertainment,"Garry Shandling, Annette Bening, John Goodman, Greg Kinnear, Ben Kingsley, Judy Greer, Danny Zorn, Harmony Smith, Richard Jenkins, Linda Fiorentino, Caroline Aaron, Nora Dunn, Cricky Long, Camryn Manheim, Ann Cusack",A human-looking alien from a highly advanced but emotionless all-male society is sent to Earth to impregnate a woman and bring the child back to their planet. The alien ends up falling in love there. A suspicious F.A.A. Agent targets him.,5.6,8995,"$60,000,000 ","$6,291,602 ",14145677.00,41,93,38
tt0093777,Il signore del male,Prince of Darkness,1987,3/10/1988,Horror,102,USA,"English, Latin",John Carpenter,John Carpenter,Alive Films,"Donald Pleasence, Jameson Parker, Victor Wong, Lisa Blount, Dennis Dun, Susan Blanchard, Anne Marie Howard, Ann Yen, Ken Wright, Dirk Blocker, Jessie Lawrence Ferguson, Peter Jason, Robert Grasmere, Thom Bray, Joanna Merlin","A research team finds a mysterious cylinder in a deserted church. If opened, it could mean the end of the world.",6.7,36120,"$3,000,000 ","$14,182,492 ",14182492.00,50,262,193
tt0377107,Proof - La prova,Proof,2005,2/3/2006,"Drama, Mystery",100,USA,English,John Madden,"David Auburn, David Auburn",Miramax,"Gwyneth Paltrow, Anthony Hopkins, Jake Gyllenhaal, Danny McCarthy, Hope Davis, Tobiasz Daszkiewicz, Gary Houston, Anne Wittman, Leigh Zimmerman, Colin Stinton, Leland Burnett, John Keefe, Chipo Chung, C. Gerod Harris, Roshan Seth","The daughter of a brilliant but mentally disturbed mathematician, recently deceased, tries to come to grips with her possible inheritance: his insanity. Complicating matters are one of her father's ex-students, who wants to search through his papers, and her estranged sister, who shows up to help settle his affairs.",6.7,42614,"$20,000,000 ","$7,535,331 ",14189860.00,64,193,137
tt0072926,Assassinio sull'Eiger,The Eiger Sanction,1975,5/21/1975,"Action, Crime, Thriller",129,USA,"English, German",Clint Eastwood,"Hal Dresner, Warren Murphy",The Malpaso Company,"Clint Eastwood, George Kennedy, Vonetta McGee, Jack Cassidy, Heidi Brรผhl, Thayer David, Reiner Schรถne, Michael Grimm, Jean-Pierre Bernard, Brenda Venus, Gregory Walcott, Candice Rialson, Elaine Shore, Dan Howard, Jack Kosslyn","Classical art professor and collector Dr. Jonathan Hemlock, who doubles as a professional assassin, is coerced out of retirement to avenge the murder of an old friend.",6.4,17167,"$9,000,000 ","$14,200,000 ",14200000.00,61,101,52
tt0088915,Chorus Line,A Chorus Line,1985,12/20/1985,"Drama, Music, Musical",113,USA,English,Richard Attenborough,"Arnold Schulman, Michael Bennett",Embassy Pictures,"Michael Blevins, Yamil Borges, Jan Gan Boyd, Sharon Brown, Gregg Burge, Michael Douglas, Cameron English, Tony Fields, Nicole Fosse, Vicki Frederick, Michelle Johnston, Janet Jones, Pam Klinger, Barbara Koval, Audrey Landers",Hopefuls try out before a demanding director for a part in a new musical.,6.2,8991,"$27,000,000 ","$14,202,899 ",14202899.00,46,95,32
tt0081455,Scanners,Scanners,1981,5/1/1982,"Horror, Sci-Fi, Thriller",103,Canada,English,David Cronenberg,David Cronenberg,Canadian Film Development Corporation (CFDC),"Jennifer O'Neill, Stephen Lack, Patrick McGoohan, Lawrence Dane, Michael Ironside, Robert A. Silverman, Lee Broker, Mavor Moore, Adam Ludwig, Murray Cruchley, Fred Doederlein, Gรฉza Kovรกcs, Sonny Forbes, Jรฉrรดme Tiberghien, Denis Lacroix",A scientist sends a man with extraordinary psychic powers to hunt others like him.,6.8,46788,CAD 4100000,"$14,225,876 ",14225876.00,60,196,132
tt0089907,Il ritorno dei morti viventi,The Return of the Living Dead,1985,4/25/1985,"Comedy, Horror, Sci-Fi",91,USA,English,Dan O'Bannon,"Rudy Ricci, John A. Russo",Cinema '84,"Clu Gulager, James Karen, Don Calfa, Thom Mathews, Beverly Randolph, John Philbin, Jewel Shepard, Miguel A. Nรบรฑez Jr., Brian Peck, Linnea Quigley, Mark Venturini, Jonathan Terry, Cathleen Cordell, Drew Deighan, James Dalesandro","When two bumbling employees at a medical supply warehouse accidentally release a deadly gas into the air, the vapors cause the dead to rise again as zombies.",7.3,53235,"$4,000,000 ","$14,237,880 ",14237880.00,66,339,237
tt0825236,Caramel,Sukkar banat,2007,12/21/2007,"Comedy, Drama, Romance",95,"France, Lebanon","Arabic, French",Nadine Labaki,"Nadine Labaki, Jihad Hojeily",Les Films des Tournelles,"Nadine Labaki, Yasmine Al Massri, Joanna Moukarzel, Gisรจle Aouad, Adel Karam, Seham Haddad, Aziza Semaan, Fatmeh Safa, Dimitri Staneofski, Fadia Stella, Ismaรฏl Antar, Cinderella Al Hajj, Daed Al Khoury, Farida Saleba, Jocelyne El Khoury",A romantic comedy centered on the daily lives of five Lebanese women living in Beirut.,7.1,12457,EUR 1300000,"$1,055,580 ",14248749.00,70,67,113
