imdb_title_id,title,original_title,year,date_published,genre,duration,country,language,director,writer,production_company,actors,description,avg_vote,votes,budget,usa_gross_income,worlwide_gross_income,metascore,reviews_from_users,reviews_from_critics
tt0395584,La casa del diavolo,The Devil's Rejects,2005,5/12/2006,Horror,107,"USA, Germany","English, Spanish",Rob Zombie,"Rob Zombie, Rob Zombie",Lions Gate Films,"Sid Haig, Bill Moseley, Sheri Moon Zombie, William Forsythe, Ken Foree, Matthew McGrory, Leslie Easterbrook, Geoffrey Lewis, Priscilla Barnes, Dave Sheridan, Kate Norby, Lew Temple, Danny Trejo, Dallas Page, Brian Posehn","The murderous, backwoods Firefly family take to the road to escape a vengeful police force which is not afraid of being as ruthless as their target.",6.8,91542,"$7,000,000 ","$17,044,981 ",20901859.00,53,735,276
tt0245712,Amores perros,Amores perros,2000,3/2/2001,"Drama, Thriller",154,Mexico,Spanish,Alejandro G. Iรฑรกrritu,Guillermo Arriaga,Altavista Films,"Emilio Echevarrรญa, Gael Garcรญa Bernal, Goya Toledo, รlvaro Guerrero, Vanessa Bauche, Jorge Salinas, Marco Pรฉrez, Rodrigo Murray, Humberto Busto, Gerardo Campbell, Rosa Marรญa Bianchi, Dunia Saldรญvar, Adriana Barraza, Josรฉ Sefami, Lourdes Echevarrรญa","A horrific car accident connects three stories, each involving characters dealing with loss, regret, and life's harsh realities, all in the name of love.",8.1,219283,"$2,000,000 ","$5,408,467 ",20908467.00,83,402,160
tt1924396,La migliore offerta,La migliore offerta,2013,1/1/2013,"Crime, Drama, Mystery",131,Italy,English,Giuseppe Tornatore,Giuseppe Tornatore,Paco Cinematografica,"Geoffrey Rush, Jim Sturgess, Sylvia Hoeks, Donald Sutherland, Philip Jackson, Dermot Crowley, Kiruna Stamell, Liya Kebede, Caterina Capodilista, Gen Seto, Klaus Tauber, Maximilian Dirr, Laurence Belgrave, Sean Buchanan, John Benfield",A lonely art expert working for a mysterious and reclusive heiress finds not only her art worth examining.,7.8,105205,EUR 13500000,"$100,035 ",20919703.00,49,199,150
tt0078790,La banda delle frittelle di mele 2,The Apple Dumpling Gang Rides Again,1979,6/27/1979,"Comedy, Family, Western",88,USA,English,Vincent McEveety,Don Tait,Walt Disney Productions,"Tim Conway, Don Knotts, Tim Matheson, Kenneth Mars, Elyssa Davalos, Jack Elam, Robert Pine, Harry Morgan, Ruth Buzzi, Audrey Totter, Richard X. Slattery, John Crawford, Cliff Osmond, Ted Gehring, Morgan Paull","The adventures of two idiotic outlaw wannabees, Amos and Theodore.",6.2,2403,"$5,450,000 ","$20,931,111 ",20931111.00,37,12,7
tt0907657,Once,Once,2007,5/30/2008,"Drama, Music, Romance",86,Ireland,"English, Czech",John Carney,John Carney,Bรณrd Scannรกn na hรireann,"Glen Hansard, Markรฉta Irglovรก, Hugh Walsh, Gerard Hendrick, Alaistair Foley, Geoff Minogue, Bill Hodnett, Danuse Ktrestova, Darren Healy, Mal Whyte, Marcella Plunkett, Niall Cleary, Wiltold Owski, Krzysztos Tlotka, Tomek Glowacki","A modern-day musical about a busker and an immigrant and their eventful week in Dublin, as they write, rehearse and record songs that tell their love story.",7.8,109134,"$150,000 ","$9,439,923 ",20936722.00,88,365,242
tt0082484,La guerra del fuoco,La guerre du feu,1981,4/1/1982,"Adventure, Drama, History",100,"Canada, France","None, French",Jean-Jacques Annaud,"Gรฉrard Brach, J.H. Rosny Sr.",International Cinema Corporation (ICC),"Everett McGill, Ron Perlman, Nicholas Kadi, Rae Dawn Chong, Gary Schwartz, Naseer El-Kadi, Franck-Olivier Bonnet, Jean-Michel Kindt, Kurt Schiegl, Brian Gill, Terry Fitt, Bibi Caspari, Peter Elliott, Michelle Leduc, Robert Lavoie",This story takes place in prehistoric time when three tribesmen search for a new fire source.,7.3,20338,"$12,500,000 ","$20,959,585 ",20962615.00,79,107,68
tt0071807,Agente 007 - L'uomo dalla pistola d'oro,The Man with the Golden Gun,1974,12/20/1974,"Action, Adventure, Thriller",125,UK,"English, Thai, Cantonese",Guy Hamilton,"Richard Maibaum, Tom Mankiewicz",Eon Productions,"Roger Moore, Christopher Lee, Britt Ekland, Maud Adams, Hervรฉ Villechaize, Clifton James, Richard Loo, Soon-Tek Oh, Marc Lawrence, Bernard Lee, Lois Maxwell, Marne Maitland, Desmond Llewelyn, James Cossins, Yao Lin Chen","James Bond is targeted by the world's most expensive assassin, while he attempts to recover sensitive solar cell technology that is being sold to the highest bidder.",6.8,93331,"$7,000,000 ","$20,972,000 ",20972000.00,43,306,100
tt2209418,Before Midnight,Before Midnight,2013,10/31/2013,"Drama, Romance",109,"USA, Greece","English, Greek, French",Richard Linklater,"Richard Linklater, Julie Delpy",Faliro House Productions,"Ethan Hawke, Julie Delpy, Seamus Davey-Fitzpatrick, Jennifer Prior, Charlotte Prior, Xenia Kalogeropoulou, Walter Lassally, Ariane Labed, Yiannis Papadopoulos, Athina Rachel Tsangari, Panos Koronis, Enrico Focardi, Manolis Goussias, Anouk Servera, Yota Argyropoulou",We meet Jesse and Celine nine years on in Greece. Almost two decades have passed since their first meeting on that train bound for Vienna.,7.9,136602,"$3,000,000 ","$8,114,627 ",20994648.00,94,323,440
tt1355631,The Infiltrator,The Infiltrator,2016,5/13/2017,"Biography, Crime, Drama",127,"UK, USA","English, Spanish",Brad Furman,"Ellen Furman, Robert Mazur",George Films,"Bryan Cranston, Leanne Best, Daniel Mays, Tom Vaughan-Lawlor, Niall Hayes, Lara Decaro, Juliet Aubrey, Olympia Dukakis, Amy Ryan, John Leguizamo, Joseph Gilgun, Jason Isaacs, Richard Katz, Fred Furman, Juan Cely",A U.S. Customs official uncovers a money laundering scheme involving Colombian drug lord Pablo Escobar.,7,66407,"$28,000,000 ","$15,436,808 ",21011110.00,66,109,187
tt0085333,Christine - La macchina infernale,Christine,1983,3/1/1984,"Horror, Thriller",110,USA,English,John Carpenter,"Stephen King, Bill Phillips",Columbia Pictures,"Keith Gordon, John Stockwell, Alexandra Paul, Robert Prosky, Harry Dean Stanton, Christine Belford, Roberts Blossom, William Ostrander, David Spielberg, Malcolm Danare, Steven Tash, Stuart Charno, Kelly Preston, Marc Poppel, Robert Darnell",A nerdish boy buys a strange car with an evil mind of its own and his nature starts to change to reflect it.,6.7,69722,"$9,700,000 ","$21,017,849 ",21017849.00,57,289,179
tt10059518,Il giorno sbagliato,Unhinged,2020,9/24/2020,"Action, Thriller",90,USA,English,Derrick Borte,Carl Ellsworth,Burek Films,"Russell Crowe, Caren Pistorius, Jimmi Simpson, Gabriel Bateman, Anne Leighton, Austin P. McKenzie, Lucy Faust, Michael Papajohn, Brett Smrz, Juliene Joyner, Stephen Louis Grush, Sylvia Grace Crim, Gregory Hobson, Devyn A. Tyler, Hick Cheramie","After a confrontation with an unstable man at an intersection, a woman becomes the target of his rage.",6.2,4720,"$33,000,000 ","$9,025,406 ",21025406.00,40,159,119
tt2707858,Yves Saint Laurent,Yves Saint Laurent,2014,3/27/2014,"Biography, Drama",106,"France, Belgium","French, English, Russian, Arabic, Japanese",Jalil Lespert,"Marie-Pierre Huster, Jalil Lespert",Wy Productions,"Pierre Niney, Guillaume Gallienne, Charlotte Le Bon, Laura Smet, Marie de Villepin, Nikolai Kinski, Ruben Alves, Astrid Whettnall, Marianne Basler, Jean-รdouard Bodziak, Adeline D'Hermy, Xavier Lafitte, Alexandre Steiger, Philippe Morier-Genoud, Anne Alvaro",A look at the life of French designer,6.3,11018,EUR 12000000,"$723,593 ",21026290.00,51,26,127
tt0083767,Creepshow,Creepshow,1982,11/12/1982,"Comedy, Fantasy, Horror",120,USA,English,George A. Romero,Stephen King,Creepshow Films Inc.,"Hal Holbrook, Adrienne Barbeau, Fritz Weaver, Leslie Nielsen, Carrie Nye, E.G. Marshall, Viveca Lindfors, Ed Harris, Ted Danson, Stephen King, Warner Shook, Robert Harper, Elizabeth Regan, Gaylen Ross, Jon Lormer",An anthology which tells five terrifying tales inspired by the E.C. horror comic books of the 1950s.,6.9,41102,"$8,000,000 ","$21,028,755 ",21028755.00,59,235,178
tt0091867,Camera con vista,A Room with a View,1985,10/3/1986,"Drama, Romance",117,UK,"English, Italian",James Ivory,"E.M. Forster, Ruth Prawer Jhabvala",Goldcrest Films International,"Maggie Smith, Helena Bonham Carter, Denholm Elliott, Julian Sands, Simon Callow, Patrick Godfrey, Judi Dench, Fabia Drake, Joan Henley, Amanda Walker, Daniel Day-Lewis, Maria Britneva, Rosemary Leach, Rupert Graves, Peter Cellier","In a Florence pensione circa 1900 with English guests, George Emerson (Julian Sands) and his dad (Denholm Elliott) offer their rooms with views to Lucy Honeychurch (Helena Bonham Carter) and her chaperone, Charlotte Bartlett (Dame Maggie Smith). Lucy and George get acquainted, but Lucy returns to England. George and Lucy meet again, but now she's engaged.",7.3,38619,"$3,000,000 ","$20,966,644 ",21040317.00,83,112,66
tt0095927,L'ultima battuta,Punchline,1988,6/23/1989,"Comedy, Drama, Romance",128,USA,"English, Spanish, French",David Seltzer,David Seltzer,Columbia Pictures,"Sally Field, Tom Hanks, John Goodman, Mark Rydell, Kim Greist, Paul Mazursky, Pam Matteson, George McGrath, Taylor Negron, Barry Neikrug, รngel Salazar, Damon Wayans, Joycee Katz, Mac Robbins, Max Alexander",A medical school dropout and a housewife/mom try to make it as stand-up comedians. They become friends and help each other out at an NYC comedy club.,5.9,7878,"$15,000,000 ","$21,042,667 ",21042667.00,52,33,22
tt0078504,I'm magic,The Wiz,1978,10/24/1978,"Adventure, Family, Fantasy",134,USA,English,Sidney Lumet,"L. Frank Baum, William F. Brown",Universal Pictures,"Diana Ross, Michael Jackson, Nipsey Russell, Ted Ross, Mabel King, Theresa Merritt, Thelma Carpenter, Lena Horne, Richard Pryor, Stanley Greene, Clyde J. Barrett, Derrick Bell, Roderick-Spencer Sibert, Kashka Banjoko, Ronald 'Smokey' Stevens","An adaptation of ""The Wizard of Oz"" that tries to capture the essence of the African-American experience.",5.4,13517,"$24,000,000 ","$21,049,053 ",21049053.00,53,160,38
tt1791682,Giovani si diventa,While We're Young,2014,7/9/2015,"Comedy, Drama, Mystery",97,USA,English,Noah Baumbach,"Noah Baumbach, Henrik Ibsen",IAC Films,"Naomi Watts, Ben Stiller, Maria Dizzia, Adam Horovitz, Matthew Maher, Peter Yarrow, Bonnie Kaufman, Hector Otero, Deborah Eisenberg, Adam Driver, Amanda Seyfried, Dree Hemingway, Matthew Shear, Annie Baker, Quincy Tyler Bernstine",A middle-aged couple's career and marriage are overturned when a disarming young couple enters their lives.,6.3,45905,"$10,000,000 ","$7,587,485 ",21075757.00,77,127,285
tt0101846,F/X 2 - Replay di un omicidio,F/X2,1991,8/23/1991,"Action, Thriller",108,USA,English,Richard Franklin,"Robert T. Megginson, Gregory Fleeman",Orion Pictures,"Bryan Brown, Brian Dennehy, Rachel Ticotin, Joanna Gleason, Philip Bosco, Kevin J. O'Connor, Tom Mason, Dominic Zamprogna, Jossie DeGuzman, John Walsh, Peter Boretski, Lisa Fallon, Lee Broker, Philip Akin, Tony De Santis","A special effects man helps his girlfriend's ex, a cop, with a sting operation, where the ex gets killed. Something's off and he investigates with help from an ex-cop PI friend.",5.9,8634,"$16,400,000 ","$21,082,165 ",21082165.00,48,27,28
tt0114608,Il cavaliere del male,Tales from the Crypt: Demon Knight,1995,1/13/1995,"Action, Fantasy, Horror",92,USA,English,Ernest R. Dickerson,"Ethan Reiff, Cyrus Voris",Tales From The Crypt Holdings,"John Kassir, Billy Zane, William Sadler, Jada Pinkett Smith, Brenda Bakke, CCH Pounder, Dick Miller, Thomas Haden Church, John Schuck, Gary Farmer, Charles Fleischer, Tim DeZarn, Sherrie Rose, Ryan O'Donohue, Tony Salome",A man on the run is hunted by a demon known as the Collector.,6.7,20849,"$13,000,000 ","$21,089,146 ",21089146.00,48,122,78
tt2125435,Re della terra selvaggia,Beasts of the Southern Wild,2012,2/7/2013,"Adventure, Drama, Fantasy",93,USA,English,Benh Zeitlin,"Lucy Alibar, Benh Zeitlin",Cinereach,"Quvenzhanรฉ Wallis, Dwight Henry, Levy Easterly, Lowell Landes, Pamela Harper, Gina Montana, Amber Henry, Jonshel Alexander, Nicholas Clark, Joseph Brown, Henry D. Coleman, Kaliana Brower, Philip Lawrence, Hannah Holby, Jimmy Lee Moore","Faced with both her hot-tempered father's fading health and melting ice-caps that flood her ramshackle bayou community and unleash ancient aurochs, six-year-old Hushpuppy must learn the ways of courage and love.",7.3,79817,"$1,800,000 ","$12,795,746 ",21107746.00,86,286,640
tt0084788,Things Are Tough All Over,Things Are Tough All Over,1982,8/4/1982,"Action, Comedy",90,USA,"English, French",Thomas K. Avildsen,"Tommy Chong, Cheech Marin",C & C Brown Production,"Toni Attell, Mike Bacarella, Billy Beck, Don Bovingloh, Richard 'Moon' Calhoun, Tommy Chong, Jennifer Condos, John Corrona, Dave Coulier, Shelby Chong, Aaron Freeman, Mike Friedman, Evelyn Guerrero, Maya Harman, Vanaghan S. Housepian","Cheech and Chong are hired to drive a limo from Chicago to Las Vegas by two shady Arabs - Mr. Slyman (Cheech) and Prince Habib (Chong). Unbeknownst to them, five million dollars of dirty money has been stuffed throughout the car.",6,3022,"$7,000,000 ","$21,134,374 ",21134374.00,40,13,5
tt0164181,Echi mortali,Stir of Echoes,1999,4/7/2000,"Horror, Mystery, Thriller",99,USA,"English, Spanish, Korean",David Koepp,"Richard Matheson, David Koepp",Artisan Entertainment,"Zachary David Cope, Kevin Bacon, Kathryn Erbe, Illeana Douglas, Kevin Dunn, Conor O'Farrell, Lusia Strus, Stephen Eugene Walker, Mary Kay Cook, Larry Neumann Jr., Jennifer Morrison, Richard Cotovsky, Steve Rifkin, Chalon Williams, Liza Weil","After being hypnotized by his sister-in-law, a man begins seeing haunting visions of a girl's ghost and a mystery begins to unfold around him.",7,73427,"$12,000,000 ","$21,142,914 ",21142914.00,67,396,156
tt0297284,Nella mente del serial killer,Mindhunters,2004,8/26/2005,"Crime, Horror, Mystery",106,"Netherlands, UK, Finland, USA",English,Renny Harlin,"Wayne Kramer, Wayne Kramer",Dimension Films,"Eion Bailey, Clifton Collins Jr., Will Kemp, Val Kilmer, Jonny Lee Miller, Kathryn Morris, Christian Slater, LL Cool J, Patricia Velasquez, Cassandra Bell, Daniรซl Boissevain, Antonie Kamerling, Jasmine Sendar, Trevor White",Trainees in the FBI's psychological profiling program must put their training into practice when they discover a killer in their midst.,6.4,57258,"$27,000,000 ","$4,480,744 ",21148829.00,33,237,132
tt4504044,The Prodigy - Il figlio del male,The Prodigy,2019,3/28/2019,"Horror, Mystery, Thriller",92,"USA, Canada",English,Nicholas McCarthy,Jeff Buhler,Orion Pictures,"Taylor Schilling, Jackson Robert Scott, Peter Mooney, Colm Feore, Paul Fauteux, Brittany Allen, Paula Boudreau, Elisa Moolecherry, Olunike Adeliyi, Janet Land, Martin Roach, Byron Abalos, Ashley Black, Tristan Vasquez, Nicholas McCarthy",A mother concerned about her young son's disturbing behavior thinks something supernatural may be affecting him.,5.8,22022,"$6,000,000 ","$14,856,291 ",21150265.00,45,369,116
tt0085382,Cujo,Cujo,1983,12/2/1983,"Horror, Thriller",93,USA,English,Lewis Teague,"Stephen King, Don Carlos Dunaway",Sunn Classic Pictures,"Dee Wallace, Danny Pintauro, Daniel Hugh Kelly, Christopher Stone, Ed Lauter, Kaiulani Lee, Billy Jayne, Mills Watson, Sandy Ward, Jerry Hardin, Merritt Olsen, Arthur Rosenberg, Terry Donovan-Smith, Robert Elross, Robert Behling","Cujo, a friendly St. Bernard, contracts rabies and conducts a reign of terror on a small American town.",6.1,38487,"$5,000,000 ","$21,156,152 ",21156152.00,57,188,131
tt0472160,Penelope,Penelope,2006,2/1/2008,"Comedy, Fantasy, Romance",104,"UK, USA",English,Mark Palansky,Leslie Caveny,Summit Entertainment,"Richard E. Grant, Catherine O'Hara, Nick Prideaux, Michael Feast, Christina Ricci, Ronni Ancona, Simon Woods, Paul Herbert, Simon Chandler, Peter Dinklage, Andi-Marie Townsend, John Voce, Burn Gorman, Andrew Bailey, James McAvoy","A modern romantic tale about a young aristocratic heiress born under a curse that can only be broken when she finds true love with ""one who will accept her as one of their own.""",6.7,59385,"$15,000,000 ","$10,011,996 ",21156270.00,48,119,117
tt0466856,ATL,ATL,2006,3/31/2006,"Comedy, Crime, Drama",105,USA,English,Chris Robinson,"Tina Gordon, Antwone Fisher",Sweet Tea Pictures LLC,"Greg Andrews, Monica, Brandon Bernard Benton, Adam Boyer, April Clark, Albert Daniels, Steven R. Ewing, Alvin Lee Fleming, Big Gipp, Bart Hansard, T.I., Khadijah Haqq, Malika Haqq, Bone Crusher, Monique Harris","As four friends prepare for life after high school, different challenges bring about turning points in each of their lives. The dramas unfold and resolve at their local rollerskating rink, Cascade.",6.1,10578,"$20,000,000 ","$21,170,563 ",21170563.00,63,98,51
tt9024106,Unplanned,Unplanned,2019,3/29/2019,"Biography, Drama",109,USA,English,"Chuck Konzelman, Cary Solomon","Abby Johnson, Chuck Konzelman",Unplanned Movie,"Ashley Bratcher, Brooks Ryan, Robia Scott, Jared Lotz, Emma Elle Roberts, Robin DeMarco, Robert Thomason, Tina Toner, Sarah Hernandez, Maura Corsini, Lezl Gonzales, Mary Montoya, Kaiser Johnson, Andee Grace Burton, Alexander Kane","All Abby Johnson ever wanted to do was help women. As one of the youngest Planned Parenthood clinic directors in the nation, she believed in a woman's right to choose. Until the day she saw something that changed everything.",5.8,12182,"$6,000,000 ","$19,005,109 ",21171090.00,10,629,34
tt0086197,Uomini veri,The Right Stuff,1983,9/15/1984,"Adventure, Biography, Drama",193,USA,"English, Russian",Philip Kaufman,"Philip Kaufman, Tom Wolfe",The Ladd Company,"Sam Shepard, Scott Glenn, Ed Harris, Dennis Quaid, Fred Ward, Barbara Hershey, Kim Stanley, Veronica Cartwright, Pamela Reed, Scott Paulin, Charles Frank, Lance Henriksen, Donald Moffat, Levon Helm, Mary Jo Deschanel","The story of the original Mercury 7 astronauts and their macho, seat-of-the-pants approach to the space program.",7.8,54959,"$27,000,000 ","$21,192,102 ",21192102.00,91,194,75
tt2243389,Gli amanti passeggeri,Los amantes pasajeros,2013,3/21/2013,Comedy,90,Spain,Spanish,Pedro Almodรณvar,Pedro Almodรณvar,El Deseo,"Antonio Banderas, Penรฉlope Cruz, Cotรฉ Soler, Antonio de la Torre, Hugo Silva, Miguel รngel Silvestre, Laya Martรญ, Javier Cรกmara, Carlos Areces, Raรบl Arรฉvalo, Pepa Charro, Nasser Saleh, Concha Galรกn, Josรฉ Marรญa Yazpik, Guillermo Toledo","When it appears as though the end is in sight, the pilots, flight crew, and passengers of a plane heading to Mexico City look to forget the anguish of the moment and face the greatest danger, which we carry within ourselves.",5.6,21524,EUR 5000000,"$1,368,119 ",21245677.00,55,67,229
tt0106598,Teste di cono,Coneheads,1993,7/23/1993,"Comedy, Sci-Fi",88,USA,English,Steve Barron,"Tom Davis, Dan Aykroyd",Paramount Pictures,"Robert Knott, Jonathan Penner, Whip Hubley, Dan Aykroyd, Jane Curtin, Howard Napper, Michael Richards, Eddie Griffin, Sinbad, Phil Hartman, Adam Sandler, Grant Martell, Art Bonilla, David Spade, Rosa Maria Briz",Aliens with conical crania crash-land on Earth.,5.3,49647,"$33,000,000 ","$21,274,717 ",21274717.00,49,101,40
tt0114681,Da morire,To Die For,1995,9/22/1995,"Comedy, Crime, Drama",106,"USA, UK, Canada",English,Gus Van Sant,"Joyce Maynard, Buck Henry",Columbia Pictures,"Nicole Kidman, Matt Dillon, Joaquin Phoenix, Casey Affleck, Illeana Douglas, Alison Folland, Dan Hedaya, Wayne Knight, Kurtwood Smith, Holland Taylor, Susan Traylor, Maria Tucci, Tim Hopper, Michael Rispoli, Buck Henry",A beautiful but naรฏve aspiring television personality films a documentary on teenagers with a darker ulterior motive.,6.8,42834,"$20,000,000 ","$21,284,514 ",21284514.00,86,179,66
tt0088814,Taron e la pentola magica,The Black Cauldron,1985,3/13/1986,"Animation, Action, Adventure",80,"USA, UK","English, Portuguese","Ted Berman, Richard Rich","Lloyd Alexander, David Jonas",Walt Disney Pictures,"Grant Bardsley, Susan Sheridan, Freddie Jones, Nigel Hawthorne, Arthur Malet, John Byner, Lindsay Rich, Brandon Call, Gregory Levinson, Eda Reiss Merin, Adele Malis-Morey, Billie Hayes, Phil Fondacaro, Peter Renaday, James Almanzar",A young boy and a bunch of misfit friends embark on a quest to find a dark magic item of ultimate power before a diabolical tyrant can.,6.4,30569,"$44,000,000 ","$21,288,692 ",21288692.00,59,154,75
tt0363282,Una pazza giornata a New York,New York Minute,2004,8/13/2004,"Comedy, Crime, Family",91,USA,English,Dennie Gordon,"Emily Fox, Emily Fox",Warner Bros.,"Ashley Olsen, Mary-Kate Olsen, Eugene Levy, Andy Richter, Riley Smith, Jared Padalecki, Drew Pinsky, Darrell Hammond, Andrea Martin, Alannah Ong, Mary Bond Davis, Bob Saget, Jack Osbourne, Joey Klein, Neil Crone","One day in New York City, Jane Ryan tries out for an overseas college program, her twin sister Roxy schemes to meet her favorite punk rockers, and a series of mishaps throws their day into ...",5,21435,"$30,000,000 ","$14,071,441 ",21289826.00,33,120,70
tt0120731,La leggenda del pianista sull'oceano,La leggenda del pianista sull'oceano,1998,10/28/1998,"Drama, Music, Romance",169,Italy,"English, French, Italian",Giuseppe Tornatore,"Alessandro Baricco, Giuseppe Tornatore",Sciarlรฒ,"Tim Roth, Pruitt Taylor Vince, Mรฉlanie Thierry, Bill Nunn, Clarence Williams III, Peter Vaughan, Niall O'Brien, Alberto Vazquez, Gabriele Lavia, John Armstead, Cory Buck, Norman Chancer, Sidney Cole, Katy Monique Cuomo, Luigi De Luca","A baby boy, discovered in 1900 on an ocean liner, grows into a musical prodigy, never setting foot on land.",8.1,57373,"$9,000,000 ","$167,435 ",21320001.00,58,279,73
tt4463894,Shaft,Shaft,2019,6/28/2019,"Action, Comedy, Crime",111,USA,English,Tim Story,"Ernest Tidyman, Kenya Barris",Davis Entertainment,"Samuel L. Jackson, Jessie T. Usher, Richard Roundtree, Regina Hall, Alexandra Shipp, Matt Lauria, Titus Welliver, Method Man, Isaach De Bankolรฉ, Avan Jogia, Luna Lauren Velez, Robbie Jones, Aaron Dominguez, Ian Casselberry, Almeera Jiwa","JJ Shaft, a cyber security expert with a degree from MIT, enlists his family's help to uncover the truth behind his best friend's untimely death.",6.4,41924,"$35,000,000 ","$21,360,215 ",21360215.00,40,360,117
tt3068194,Amore e inganni,Love & Friendship,2016,12/1/2016,"Comedy, Drama, Romance",90,"Ireland, France, Netherlands","English, French",Whit Stillman,"Whit Stillman, Jane Austen",Westerly Films,"Kate Beckinsale, Morfydd Clark, Tom Bennett, Jenn Murray, Lochlann O'Mearรกin, Sophie Radermacher, Chloรซ Sevigny, Stephen Fry, Jordan Waller, Ross Mac Mahon, Frank Prendergast, Xavier Samuel, Emma Greenwell, Justin Edwards, Kelly Campbell","Lady Susan Vernon takes up temporary residence at her in-laws' estate and, while there, is determined to be a matchmaker for her daughter Frederica -- and herself too, naturally.",6.4,22650,"$3,000,000 ","$14,016,568 ",21401949.00,87,116,230
tt1305583,Matrimonio in famiglia,Our Family Wedding,2010,7/23/2010,"Comedy, Romance",103,USA,English,Rick Famuyiwa,"Wayne Conley, Wayne Conley",Fox Searchlight Pictures,"Forest Whitaker, America Ferrera, Carlos Mencia, Regina King, Lance Gross, Diana Maria Riva, Lupe Ontiveros, Anjelah Johnson-Reyes, Charlie Murphy, Shannyn Sossamon, Tonita Castro, Anna Maria Horsford, Warren Sapp, Shondrella Avery, Sterling Ardrey","The weeks leading up to a young couple's wedding are comic and stressful, especially as their respective fathers try to lay their long standing feud to rest.",5,6651,"$14,000,000 ","$20,255,281 ",21409028.00,38,25,69
tt0080130,Quando chiama uno sconosciuto,When a Stranger Calls,1979,10/26/1979,"Horror, Mystery, Thriller",97,USA,English,Fred Walton,"Steve Feke, Fred Walton",Melvin Simon Productions,"Carol Kane, Rutanya Alda, Carmen Argenziano, Kirsten Larkin, William Boyett, Charles Durning, Ron O'Neal, Heetu, Rachel Roberts, Tony Beckley, Colleen Dewhurst, Michael Champion, Joseph Reale, Ed Wright, Louise Wright","A psychopathic killer terrorizes a babysitter, then returns seven years later to menace her again.",6.5,9387,"$1,500,000 ","$21,411,158 ",21411158.00,58,135,77
tt0102744,Carabina Quigley,Quigley Down Under,1990,10/19/1990,"Action, Adventure, Drama",119,"Australia, USA","English, Aboriginal",Simon Wincer,John Hill,Pathรฉ Entertainment,"Tom Selleck, Laura San Giacomo, Alan Rickman, Chris Haywood, Ron Haddrick, Tony Bonner, Jerome Ehlers, Conor McDermottroe, Roger Ward, Ben Mendelsohn, Steve Dodd, Karen Davitt, Kylie Foster, William Zappa, Jonathan Sweet","Sharpshooter Matt Quigley is hired from Wyoming by an Australian rancher paying a very high price. But when Quigley arrives Down Under, all is not as it seems.",6.9,19179,"$20,000,000 ","$21,413,105 ",21413105.00,51,118,30
tt0098987,Le avventure di Ford Fairlane,The Adventures of Ford Fairlane,1990,7/11/1990,"Action, Adventure, Comedy",104,USA,English,Renny Harlin,"Daniel Waters, James Cappe",Twentieth Century Fox,"Andrew Dice Clay, Wayne Newton, Priscilla Presley, Morris Day, Lauren Holly, Maddie Corman, Gilbert Gottfried, David Patrick Kelly, Brandon Call, Robert Englund, Ed O'Neill, Vince Neil, Sheila E., David Arnott, Mark Goldstein",A vulgar private detective is hired to find a missing groupie and is drawn into a mystery involving a series of murders tied to the music industry.,6.5,16914,"$20,000,000 ","$21,413,502 ",21413502.00,24,120,56
tt0088001,Nick lo scatenato,Rhinestone,1984,6/22/1984,"Comedy, Music",111,USA,English,Bob Clark,"Phil Alden Robinson, Phil Alden Robinson",Twentieth Century Fox,"Sylvester Stallone, Dolly Parton, Richard Farnsworth, Ron Leibman, Tim Thomerson, Steve Peck, Penny Santon, Russell Buchanan, Ritch Brinkley, Jerry Potter, Jesse Welles, Phil Rubenstein, Thomas Ikeda, Christal Kim, Arline Miyazaki",A country music star must turn an obnoxious New York cabbie into a singer in order to win a bet.,3.9,6731,"$28,000,000 ","$21,435,321 ",21435321.00,36,60,17
